{
  "eval_id": "cifar100-wrn28x10-late-sam-eval-001",
  "run_id": "cifar100-wrn28x10-late-sam-001",
  "metrics": [
    "top1_accuracy",
    "per_class_accuracy",
    "confusion_matrix",
    "inference_latency_ms",
    "parameter_count",
    "flops",
    "peak_inference_memory_mb"
  ],
  "comparison_targets": [
    "published_cifar100_sota",
    "repo_internal_pareto_front"
  ],
  "notes": [
    "Track whether late-phase SAM closes most of the accuracy gap to always-on SAM with lower wall-clock overhead.",
    "Use this run as the first modern baseline before more aggressive architecture changes."
  ]
}
