{
  "eval_id": "birdclef2026-effnet-b0-gem-eval-001",
  "run_id": "birdclef2026-effnet-b0-gem-001",
  "pseudo_label_round": 0,
  "inference_budget": {
    "max_latency_ms": 5000,
    "max_peak_memory_mb": 32000,
    "must_fit_kaggle_notebook": true
  },
  "metrics": [
    "birdclef_leaderboard_score",
    "roc_auc",
    "macro_auroc",
    "per_class_auroc",
    "calibration_error",
    "inference_latency_ms",
    "parameter_count",
    "flops",
    "peak_inference_memory_mb"
  ],
  "comparison_targets": [
    "repo_internal_pareto_front",
    "published_birdclef_cnn_references"
  ],
  "notes": [
    "Validation must be group-aware and leaderboard-calibrated.",
    "Use this as the main single-model CNN reference before larger backbones or pseudo-label rounds."
  ]
}
